Article num,Title,URL,Summary
0,日銀は利上げで来年も世界の中銀で特異な存在に－米ＦＲＢは利下げへ,https://www.bloomberg.co.jp/news/articles/2023-12-14/S5LJGPT0G1KW00?srnd=cojp-v2,日本銀行は、数十年にわたりデフレ退治に挑む中で、金融政策で特異な存在であることに慣れてしまった。それは2024年も変わらない可能性が高い。消費者物価が１年半余りにわたり物価目標の２％を上回る水準で推移する中、植田和男総裁は世界最後のマイナス金利政策を撤廃するとの見方が広がっている。一方、市場では米連邦準備制度理事会（ＦＲＢ）がほぼ同じ時期に利下げを開始するとの見通しが強まっている。「今できるのか、もうできないのかという状況」と語るのは、日銀出身で物価研究が専門の渡辺努東京大学大学院教授。「もし今回の局面で正常化できない場合は、残りの任期は同じ金融緩和を続けていくしかないだろう」との見方を示す。氷見野良三副総裁が６日の講演で、大規模な金融緩和政策からの出口が家計や企業、金融機関に与えるメリットに言及。７日には植田総裁が「年末から来年にかけて一段とチャレンジングな状況になる」と発言したことから、市場には早期の政策正常化観測が急速に強まった。総裁発言を受けて７日の東京市場では急速に円高が進み、10年国債利回りが今年最大の上げ幅を記録した。金融政策予想を反映するオーバーナイト・インデックス・スワップ（ＯＩＳ）市場は、１月会合までのマイナス金利解除（0.1％の利上げ）の確率を４割弱と見込んでいる。事情に詳しい複数の関係者によると、日銀は今月18、19日の金融政策決定会合で、政策正常化に急いで踏み出す必要性はほとんどないと認識しているという。ブルームバーグがエコノミスト52人を対象に１－６日に実施した調査では、マイナス金利解除が来年４月会合までに行われるとの予想が67％で、最多は４月の50％だった。マイナス金利解除、日銀は今月急ぐ必要ほとんどないとの認識－関係者一方、ＦＲＢは13日の連邦公開市場委員会（ＦＯＭＣ）会合で、３回連続となる主要政策金利の据え置きを決定した。2024年に複数回にわたり、合計で0.75ポイントの利下げを行うことも示唆され、積極的な利上げキャンペーンが終了したとのシグナルを明確に発した。ＦＯＭＣの決定を受け、事前に利下げけん制を想定していた市場は大きく反応。米金利は期間が短い債券利回りを中心に低下。米金利先物市場が織り込む利下げ開始時期は３月が80％程度とＦＯＭＣ決定前の40％程度から大幅に上昇した。外国為替市場で円相場は１ドル＝141円台後半まで上昇している。世論と政局世論も日銀の政策正常化を後押しする。通常であれば企業や家計の借り入れコストが膨らむことになる利上げは、政治を含めて抵抗が強いが、インフレ懸念が世界を覆う中で、価格転嫁が受け入れられやすい情勢にある。岸田文雄政権は経済対策の柱に物価高対策を掲げており、その裏付けとなる23年度の補正予算が臨時国会で11月に可決されたばかりだ。日銀が超低金利政策を続けることによる日米の金融政策の方向性の違いが一時、１ドル＝150円を超えた円安につながり、輸入物価の上昇が食料品や日用品の値上げを招いてきた。足元では物価上昇を反映して実質賃金が19カ月連続でマイナスとなっており、日銀の緩和政策への家計の批判も強まりやすい。一方、岸田政権は自民党の派閥による政治資金パーティー収入の裏金化問題の対応に追われている。岸田首相は13日の会見で日銀の金融政策運営について、デフレ完全脱却や構造的な賃上げなど政府の経済対策を「しっかり念頭に置きながら、適切な判断を期待したい」と語った。政局が混迷する中、拙速な金融政策変更が市場の混乱を招き、政権の足を引っ張るような事態は日銀としても避けたいところだ。コミュニケーションマイナス金利解除後の政策運営を円滑に進めるためにも、日銀の説明と政策変更の内容やタイミングがいかに整合的に行われるかが重要なポイントになる。足元まで19カ月連続で日銀の目標の２％を上回って推移する消費者物価（生鮮食品を除くコアＣＰＩ）について植田総裁は、輸入物価上昇に伴う価格転嫁が中心であり、２％物価目標の持続的・安定的な実現につながるものではないと説明している。目標達成には、コストプッシュ圧力が減衰した後もインフレ期待や需給ギャップ、賃金などを反映する基調的な物価上昇率が徐々に高まり、賃金と物価の好循環が実現することが不可欠という。今年の賃上げは30年ぶりの高水準を実現したが、物価上昇が賃金を押し上げるだけではなく、賃金が物価に波及する相互関係の強まりが重要との見立てだ。日銀は来年の春季労使交渉（春闘）の重要性に何度も言及しているが、持続的・安定的な物価２％の実現に必要な水準や判断できるタイミングなどは明らかにしていない。植田総裁は10月の会見で、「見通し実現の確度が少し高まってきていることは事実」としつつ、「閾値みたいなところにまだ達してない」と説明した。恣意的な要素が入り込む可能性は残っている。米ピーターソン国際経済研究所のアダム・ポーゼン所長は、日銀の金融政策について「もし春闘が低調に終わり、2024年６月、７月に低いインフレ率の数字が出始めれば、正当な理由による利上げは難しくなるだろう」と指摘。その上で「純粋な予想として、３月末までに利上げが行われる可能性は50ー70％だとみている」と語った。一部のエコノミストは、日銀の政策正常化によって日本の投資家が資金を自国に還流させた場合、国際金融市場に影響を与えることを懸念している。ＧＤＰの約1.3倍に膨らんだバランスシートが出口局目で日銀財務に与える影響に加え、保有する多額の国債や上場投資信託（ＥＴＦ）の処理方法、日本の財政負担の拡大など課題は山積している。米ハーバード大学のケネス・ロゴフ教授は、「最も深刻な金融危機は、思いがけないところで起こることが多い」とし、「日本の復活は世界経済にとって良いことだが、日本の金利が復活することは大きなリスクとなり得る」と述べた。関連記事
1,ＦＲＢ、来年の利下げに向け地ならし、インフレ圧力緩和受け方向転換,https://www.bloomberg.co.jp/news/articles/2023-12-14/S5MT48T1UM0W00?srnd=cojp-v2,米金融当局は13日、過去数十年ぶりの急ピッチで進めた利上げを反転する方向にかじを切った。当局のインフレ抑制策はこれまで、リセッション（景気後退）や雇用情勢の深刻な悪化を招くことなく進展を遂げてきた。パウエル連邦準備制度理事会（ＦＲＢ）議長は同日、物価上昇圧力が再燃した場合、当局として利上げを再開する用意を表明。それでも、議長を含む当局者による最新の四半期経済予測では2024年に複数回の利下げが想定されていることが示された。関連記事：連邦公開市場委員会（ＦＯＭＣ）は同日までの２日間の会合で、政策金利を22年ぶりの高水準に３回連続で据え置くことを決めたが、議長は会合後の記者会見で、利下げが議論されたことを明らかにした。パウエル議長が会見で、投資家の間に広がる24年の利下げ観測を押し返そうとしなかったことで債券相場は上昇し、ダウ工業株30種平均は過去最高値を更新した。今月１日の時点で利下げ時期を臆測するには「時期尚早」としていた議長だが、会見では「それが視野に入り始めており、話題になっているのは明白だ。今回の会合でも議論した」と述べ、当局者が検討を始めたことを認めた。当局はフェデラルファンド（ＦＦ）金利の誘導目標レンジを5.25－5.5％に据え置くことを全員一致で決めた。他方、最新の 四半期経済予測によれば、ＦＯＭＣ参加者が見込む追加利上げは予想中央値で21年３月以来のゼロとなった。また、来年の利下げ幅の予想中央値は計0.75ポイントと、９月の前回予測の0.5ポイントから拡大した。なお、24年末時点のＦＦ金利は中央値で4.6％と予想されているものの、個々の当局者の見通しには大きなばらつきがある。ＬＨマイヤー／マネタリー・ポリシー・アナリティクスのエコノミスト、デレク・タン氏はパウエル議長の会見について、利上げ完了のトーンがあったのは確かだと指摘。早期に従来想定よりも大幅な利下げがあるとの市場の臆測に対し、議長らＦＯＭＣ参加者全員が金利予測分布図（ドット・プロット）を使って押し返す必要性を感じていなかった様子だと分析した。記者会見したパウエルＦＲＢ議長 Source: Bloombergこのほか、シティグループのエコノミスト、ベロニカ・クラーク氏はＦＯＭＣ声明とパウエル議長に関し、「声明にはテクニカルには利上げバイアスがあり、議長もまだそのように話しているが、誰も信じていない」とし、「次のステップが利下げであることは誰もが分かっており、議長もそれを確認した」と話した。ＦＦ金利先物市場でトレーダーが織り込む来年の利下げ回数は現時点で計６回と、今週の早い時点の４回から増え、トレーダーは３月のＦＯＭＣ会合での利下げの可能性を100％織り込んでいる。パウエル議長は過去数カ月にわたり、インフレ抑制を実質的に自身唯一の責務に位置づけ、物価高対策には「多少の痛み」を伴うと警告してきた。現状を見ると、経済のソフトランディング（軟着陸）が保証されたにはほど遠いものの、労働者にとっておおむね痛みのない形でインフレ鈍化が進んでいる。議長は「これまでに進展が見られたのは非常に良いことだ」とした上で、「さらなる進展が必要だ」と語った。ブルームバーグ・エコノミクス（ＢＥ）の米国担当チーフエコノミスト、アナ・ウォン氏らは「市場が織り込む利下げについて、ＦＯＭＣは意外なほど是認する意向を示した。最新の四半期経済予測は軟着陸シナリオの全面的な受け入れを反映している」との見解を示した。パウエル議長は今回、物価安定と最大限の雇用の実現という二つの責務を巡り、リスクバランスの均衡を図る必要性に一段と明確に言及した。具体的には、金利を過度の高水準に維持することに関し、「あまりにも長く踏みとどまることのリスクを認識しいている」とし、「われわれはそれがリスクであることを分かっており、そうしたミスを犯さぬよう非常に集中的に取り組んでいる」と発言した。ＫＰＭＧのチーフエコノミスト、ダイアン・スウォンク氏はブルームバーグテレビジョンとのインタビューで、「インフレ鈍化の事実に当局者がエキサイトしているのは間違いない」とコメントした。原題： Fed Prepares Shift to Rate Cuts in 2024 as Price Pressures Fade（抜粋）
2,史上最高３万9000円へ期待高まる日本株、慎重だった米シティも強気に,https://www.bloomberg.co.jp/news/articles/2023-12-13/S59WY6T0AFB400?srnd=cojp-v2,今年のアジア株式市場で上昇率トップの座をほぼ手中にした日本株に対し、2024年も好調が続くとの見方がストラテジストの間で広がっている。ブルームバーグが各社の予想をまとめたところ、海外景気の後退懸念から今年後半は最も慎重な見方の１社だった米シティグループ証券も強気に転じ、日経平均株価は35年ぶりに史上最高値を奪回すると予想した。国内外証券会社６社による日本株指数の24年末予想値（中央値）は、東証株価指数（ＴＯＰＩＸ）で2650ポイント、日経平均で３万7750円。現在の水準と比べると、12－15％の上昇余地がある計算だ。中でもＴＯＰＩＸで2800、日経平均で３万9000円と最も高い予想値を示したのはシティＧ証。株式ストラテジストの阪上亮太氏は内需の回復やインフレによる名目収益の押し上げ効果などを受け、「史上最高値の更新は可能」とみている。オーバーウエートを推奨するセクターにはデフレ脱却の恩恵を受ける不動産、収益環境の改善が見込まれる金融セクターを挙げた。日経平均の終値ベースの最高値は1989年12月に付けた３万8915円。金融機関名 ＴＯＰＩＸ 日経平均株価 シティグループ証券 2800 ３万9000円 ＪＰモルガン証券 2500 ３万5000円 野村証券 － ３万8000円 モルガン・スタンレー 2600 － ゴールドマン・サックス証券 2650 － ＢｏｆＡ証券 2650 ３万7500円ブルームバーグが６月に23年後半の日本株展望について市場関係者に調査した際、シティＧ証の日経平均の年末予想値は２万6000円と６社の中で最も低く、阪上氏は米国や中国の景気後退リスクについて言及していた。日本株に割高感浮上、日経平均は３万2000円台で息切れか－年後半展望今年の日本株は長年のデフレから脱却し、賃金上昇を伴うインフレ経済への転換期待から主要株価指数は33年ぶりの水準となるバブル経済崩壊後の戻り高値を更新。東京証券取引所が株価純資産倍率（ＰＢＲ）１倍割れ企業に対し、資本効率の改善を求める動きも経営改革期待につながった。需給面では、米著名投資家のウォーレン・バフェット氏を含む海外投資家の買いがけん引役となった。フィデリティ投信副社長運用本部長の鹿島美由紀氏は、日本経済は長期的な好循環に入っており、株価も堅調に推移すると予測。24年からは労働基準法改正の対象が物流まで拡大するため、総賃金の上昇圧力が強まり、経済の好循環は続くの見方を示している。迫る物流2024年問題、物価高襲う日本をトラック運転手不足が追い打ちＴＯＰＩＸの年間パフォーマンスは14日時点でプラス25％と、10年ぶりの上昇率でアジア市場ではトップとなる見込みだ。低迷する中国株から日本株に資金をシフトする動きも相場を押し上げる一因となり、こうした動きは24年も続くとの見方がある。中国株から日本株への資金流入、2024年まで続く可能性－ＪＰモルガンまた、24年１月から行われる少額投資非課税制度（ＮＩＳＡ）の拡充を背景とした国内個人投資家からの資金流入を期待する声も出ている。新ＮＩＳＡで日本株需給変化か、投信フローが示す個人大転換の可能性一方、 日本銀行の金融政策正常化に伴う金利上昇の可能性や為替の円高進行リスクは日本株のマイナス要因になるとの見方は多い。ブルームバーグの 調査では、来年４月に行われる金融政策決定会合までにマイナス金利の解除を見込む声が大勢だ。野村証券チーフ・エクイティ・ストラテジストの池田雄之輔氏は、24年後半には日銀の政策正常化や円高の定着などによって日本株の上値が重くなると予測。米モルガン・スタンレーのセリーナ・タン氏も、予想以上の政策変更や予想を下回る世界経済の成長率を背景に円相場が上昇することが日本株にとってのリスクと指摘している。関連記事：
3,「転換の24年」早期利下げは可能か－借り換えの痛み企業や政府直撃も,https://www.bloomberg.co.jp/news/articles/2023-12-14/S5LAEMT0G1KW00?srnd=cojp-v2,"「ピボット（方向転換）」の年と呼ぶことにしよう。過去40年でも最も積極的な利上げサイクルを経て、2024年は主要中央銀行が利下げにかじを切る見通しだ。これまでの引き締めの影響を和らげ、ハードランディングを回避できる十分速い方向転換が、今後数カ月のインフレ指標次第で可能になるかどうか、それが重要な問題だ。先進諸国の消費者物価指標が10月は 過去２年で最も低い伸びとなり、来年の方向転換に対する投資家の確信を心強いデータが支えている。欧州中央銀行（ＥＣＢ）のシュナーベル理事、米連邦準備制度理事会（ＦＲＢ）の ウォラー理事のようなインフレ・タカ派の最近のコメントからも引き締めから遠ざかる傾向がうかがえる。13日まで開催された米連邦公開市場委員会（ＦＯＭＣ）会合では、フェデラルファンド（ＦＦ）金利の誘導目標（5.25－5.5％）の据え置きが決まる一方、来年の３回の利下げ見通しが示された。インフレ率が２％の物価目標に向け下降を続ける中で、パウエルＦＲＢ議長は、今やいつ利下げを開始すべきかが政策担当者の関心の焦点だと示唆した。関連記事Global Debt Refinancing Costs Have Soared Global bonds' average yield minus coupon on outstanding debt, in basis points Source: Bloombergそれでも超低金利の融資や債券が返済期限を迎え、はるかに高いコストで新たに借り入れが行われる状況では、転換が遅くなれば、企業と家計が受ける打撃も大きくなる。高い金利コストを背景に米中小企業の楽観的な見方が抑制され続け、ユーロ圏の複数の国で経済が縮小し、変動金利住宅ローンが主体のカナダのような国で住宅所有者が支出を減らしている。モルガン・スタンレーの米国担当チーフエコノミスト、エレン・ゼントナー氏は「24年は移行の年だ。経済と金融政策にとって転換点になる。だがそれは何を意味するのか。成長からリセッション（景気後退）への転換点か、それとも力強い成長が鈍化する転換点なのか」と問い掛ける。Traders Are Betting on 2024 Rate Cuts Change in central bank rates, in basis points Source: Bloombergゼントナー氏らのチームは米国で後者になる可能性に賭けている。未払い住宅ローンの平均金利が４％を下回り、家計のバランスシートが引き続き「非常に守られた」状態にあることも理由だ。同氏によれば、モルガン・スタンレーの予測通り、米連邦準備制度が来年６月までに 利下げを開始すれば、ハードランディングリスクの抑制に役立つはずだ。今の水準に金利が長くとどまればとどまるほど、そうした危険は高まる。オックスフォード・エコノミクスの集計データによると、満期を迎える米企業債務は今後２年で倍増し、25年に約１兆ドルに達する。ユーロ圏では4000億ドル余りと３倍に増える。High-Yield Companies Shorten Their Debt Maturities Issuers have borrowed shorter since central banks hiked interest rates Source: Bloomberg投資適格を下回る格付けの企業は特に脆弱（ぜいじゃく）で、今回の利上げサイクル中に債務返済ないし償還までの期間は米国で５年未満、ユーロ圏で４年未満と著しく短くなった。ドイツ銀行の欧州＆米国クレジット戦略責任者ジム・リード氏は「ハイイールド（高利回り）市場の満期までの期間は私のキャリアでかつてなく短い」と指摘した。（原文は「ブルームバーグ・ビジネスウィーク」誌に掲載）原題： Rate Cuts Can’t Come Fast Enough for Debt-Strapped Companies（抜粋）"
4,円が対ドルで１％超上昇、ＦＯＭＣ受けた米金利低下でドル売り,https://www.bloomberg.co.jp/news/articles/2023-12-14/S5N0XJT1UM0W00?srnd=cojp-v2,14日の東京外国為替市場では円が対ドルで１％超上昇し、140円台後半を付けた。米連邦公開市場委員会（ＦＯＭＣ）がハト派的と受け止められ、米国金利の大幅低下でドル売りが強まり、円が押し上げられている。円は対ドルで一時、前日比1.3％高の140円97銭まで上昇し、７月31日以来の高値を付けた。13日の海外市場では145円台前半から142円台後半まで急騰していた。ＦＯＭＣは３会合連続で金利を据え置き、当局者の2024年の利下げ見通しが合計0.75％ポイントに９月時点から拡大した。米連邦準備制度理事会（ＦＲＢ）のパウエル議長は会見で、利下げのタイミングを協議したことを明らかにした。金融政策に対する感応度が高い米２年債利回りが30ベーシスポイント（ｂｐ、１ｂｐ＝0.01％）の大幅低下となり、米金利スワップ市場では来年３月までの利上げを織り込んでいる。関連記事
